{
  "schema_version": 1,
  "id": "8rldook2lgxz",
  "type": "collection",
  "subtype": "book_collection",
  "title": "高文襄公集十八種",
  "authors": [
    {
      "name": "高拱",
      "role": "撰",
      "dynasty": "明"
    }
  ],
  "edition": "明萬曆四十二年馬之駿等刻本",
  "publication_info": {
    "year": "1614",
    "details": "刊刻者：馬之駿等"
  },
  "count": {
    "juan": null,
    "ce": null,
    "zhong": 18,
    "han": null,
    "source": "種數取題名「高文襄公集十八種」"
  },
  "indexed_by": [
    {
      "source": "中國古籍總目",
      "source_bid": "1exjosng9241s",
      "title_info": "高文襄公集十八種",
      "summary": "高文襄公集十八種｜明高拱撰｜明萬曆四十二年馬之駿等刻本｜河南省圖書館"
    }
  ],
  "sources": [
    {
      "id": "7w5iioeop4jpzi0a",
      "name": "中國古籍總目（上圖聯合目錄）",
      "type": "url",
      "details": "https://gj.library.sh.cn/unionCatalogue/work/list#uri=http://data.library.sh.cn/gj/resource/instance/7w5iioeop4jpzi0a&from=evidence"
    }
  ],
  "ai_note": "【叢書线·Collection】叢書线（GUJI-526）據《中國古籍總目》（上圖聯合目錄）自動錄入；源記錄：7w5iioeop4jpzi0a\n叢書线（GUJI-526 口徑）：叢書自成 Collection，子目登 Book 挂其下、不判 Work。總目著錄子目 18 種。\n館藏：河南省圖書館",
  "revision": "1.0.0",
  "revised_at": "2026-10-20"
}
